timestamp,time,f_scale,location,county,state,latitude,longitude,comments
2016-05-10 01:23:00+00:00,0123,UNK,7 S COON RAPIDS,GUTHRIE,IA,41.78,-94.69,ROPE TORNADO HAS MOVED TO NEAR 155TH AND DOGWOOD AT 823 PM. CONTINUES TO FORM AND LIFT. SAME STORM AS BEFORE. (DMX)
2015-06-25 00:03:00+00:00,0003,UNK,6 SSW PANORA,GUTHRIE,IA,41.62,-94.42,(DMX)
2017-03-07 03:47:00+00:00,0347,UNK,1 S BERNARD,JACKSON,IA,42.29,-90.83,947 PM TO 955 PM CST. EF0. PEAK WINDS 85 MPH. PATH LENGTH 5.7 MILES. MAX WIDTH 25 YARDS. END POINT 5.1 MILES ENE OF BERNARD IN DUBUQUE COUNTY. NUMEROUS TREES SUFFERED D (DVN)
2016-07-17 12:03:00+00:00,1203,UNK,1 SW ANDREW,JACKSON,IA,42.15,-90.6,EF-1 TORNADO CROSSED THE SOUTHERN PARTS OF THE TOWN OF ANDREW. A BUILDING AT THE AG COOP WAS DESTROYED AND NUMEROUS TREES WERE SNAPPED. (DVN)
2016-07-17 11:03:00+00:00,1103,UNK,1 SW ANDREW,JACKSON,IA,42.15,-90.6,EF-1 TORNADO CROSSED THE SOUTHERN PARTS OF THE TOWN OF ANDREW. A BUILDING AT THE AG COOP WAS DESTROYED AND NUMEROUS TREES WERE SNAPPED. (DVN)
2017-07-21 22:44:00+00:00,2244,UNK,6 NE KALONA,JOHNSON,IA,41.55,-91.62,REPORT DELAYED - POSSIBLE TORNADO MOVING NORTHEAST - FUNNEL CLOUD APPEARED TO BRIEFLY TOUCH DOWN THEN LIFTED BACK INTO THE STORM (DVN)
2016-07-27 22:16:00+00:00,2216,UNK,5 WNW ALGONA,KOSSUTH,IA,43.1,-94.33,SMALL AND BRIEF LANDSPOUT TORNADO TOUCHED DOWN AND HAS SINCE LIFTED. NO REPORTS OF DAMAGE. (DMX)
2015-11-11 21:00:00+00:00,2100,UNK,6 W WINTERSET,MADISON,IA,41.33,-94.13,NWS STORM SURVEY CONFIRMED SIGNIFICANT TREE DAMAGE ALONG STATE HIGHWAY 92. THIS IS CONSISTENT WITH EF-1 DAMAGE. OTHER SPORADIC TREE DAMAGE OCCURRED BOTH SOUTHWEST AND N (DMX)
2017-06-28 21:14:00+00:00,2114,UNK,4 S EARLHAM,MADISON,IA,41.43,-94.13,(DMX)
2015-11-11 20:55:00+00:00,2055,UNK,4 WNW EAST PERU,MADISON,IA,41.25,-93.99,NWS STORM SURVEY CONFIRMED A WEAK TORNADO SEVERAL MILES WEST OF EAST PERU. CORN WAS FLATTENED IN SEVERAL FIELDS AND SPORADIC TREE DAMAGE WAS NOTED ALONG THE PATH. THIS (DMX)
2015-11-11 22:24:00+00:00,2224,UNK,3 SSW BARNES CITY,MAHASKA,IA,41.46,-92.48,EXTENSIVE TREE DAMAGE AND FARM BUILDINGS DESTROYED AT A RESIDENCE. POLE DAMAGE ALONG V13 AND ADDITIONAL DAMAGE TO BUILDINGS AND TREES ON THE WEST SIDE OF BARNES CITY. T (DMX)
2017-06-28 21:34:00+00:00,2134,UNK,BRADDYVILLE,NODAWAY,IA,40.58,-95.04,RELAYED REPORT FROM LAW ENFORCEMENT (OAX)
2015-10-23 23:18:00+00:00,2318,UNK,3 E HOSPERS,O'BRIEN,IA,43.07,-95.85,ON THE GROUND FOR 3 MINUTES (FSD)
2017-08-19 01:07:00+00:00,0107,UNK,5 NW MELVIN,OSCEOLA,IA,43.34,-95.68,EF2 TORNADO TRAVELED 6 MILES WITH A 250 YARD WIDE PATH. THE TORNADO LIFTED AT 8:27 ABOUT A 1/2 MILE SOUTHWEST OF MELVIN. (FSD)
2017-03-06 23:30:00+00:00,2330,UNK,3 ENE HARCOURT,WEBSTER,IA,42.28,-94.13,SPOTTER REPORTED SEEING SWIRLING DUST... DAMAGE HAS BEEN REPORTED IN THE AREA. . (DMX)
2017-03-06 23:42:00+00:00,2342,UNK,3 NE HARCOURT,WEBSTER,IA,42.28,-94.13,WEBSTER COUNTY EM REPORTED TREE DAMAGE AND DEBRIS IN A 1.5 MILE LONG AND 30 YARD WIDE DAMAGE PATH. (DMX)
2017-08-19 02:21:00+00:00,0221,UNK,3 ESE LARRABEE,CHEROKEE,IA,42.85,-95.49,DELAYED REPORT. EF0 TORNADO SURVEYED 3 ESE LARRABEE. TRAVELED 0.3 MILES WITH A PATH WIDTH OF 25 YARDS. MINOR CROP AND TREE DAMAGE. TORNADO LIFTED AT 9:27 PM. (FSD)
2015-10-23 23:39:00+00:00,2339,UNK,2 N LARRABEE,CHEROKEE,IA,42.89,-95.54,TORNADO LIFTS ROOF OFF HOUSE (FSD)
2016-07-23 21:18:00+00:00,2118,UNK,3 SW DELHI,DELAWARE,IA,42.4,-91.37,VIDEO OF NARROW TORNADO CROSSING THE SOUTHWEST PORTION OF LAKE DELHI. (DVN)
2016-06-29 22:56:00+00:00,2256,UNK,4 SW PERSIA,HARRISON,IA,41.54,-95.62,(OAX)
2016-07-27 23:41:00+00:00,2341,UNK,2 WSW BODE,HUMBOLDT,IA,42.86,-94.33,BRIEF TOUCHDOWN. HAS SINCE LIFTED. (DMX)
2015-07-17 01:34:00+00:00,0134,UNK,6 SW OSAGE,MITCHELL,IA,43.22,-92.9,BRIEF TORNADO TOUCHED DOWN SOUTHWEST OF OSAGE FLIPPING A GARAGE...DESTROYING A BARN AND CAUSING DAMAGE TO SIDING DUE TO FLYING DEBRIS. MULTIPLE TREES WERE UPROOTED OR S (ARX)
2016-05-28 22:52:00+00:00,2252,UNK,2 NNW KINGSLEY,PLYMOUTH,IA,42.61,-95.98,BRIEF TORNADO TOUCHDOWN IN CORN FIELD. (FSD)
2015-11-11 20:17:00+00:00,2017,UNK,5 SSE KENT,RINGGOLD,IA,40.89,-94.41,TREES DOWN TWO BARNS FLATTENED. WINDOWS BROKEN OUT OF HOUSE. (NEAR HOG BUILDINGS)  BROKEN WINDOWS AND DOORS- POSSIBLE ROOF DAMAGE. TIME ESTIMATED BY RADAR. TDS OBSER (DMX)
2015-11-11 20:38:00+00:00,2038,UNK,1 ENE BENTON,RINGGOLD,IA,40.71,-94.34,(DMX)
2017-03-07 02:30:00+00:00,0230,UNK,2 SE CENTERVILLE,APPANOOSE,IA,40.71,-92.85,UNCONFIRMED TORNADO. REPORT OF DAMAGE TO INDUSTRIAL BUILDINGS. POWER POLES SNAPPED. SEMI TRUCKS BLOWN OVER. . (DMX)
2015-11-11 21:27:00+00:00,2127,UNK,6 S MELROSE,APPANOOSE,IA,40.9,-93.03,HOUSE SEVERELY DAMAGED IF NOT DESTROYED. ADDRESS WAS NOT KNOWN AT THIS TIME BUT WAS WEST OF ICONIUM ON NORTH SIDE OF RATHBUN LAKE. TIME ESTIMATED FROM RADAR. (DMX)
2015-05-03 22:34:00+00:00,2234,UNK,2 E TERRIL,DICKINSON,IA,43.31,-94.93,ON GROUND FOR 2 MINUTES OVER OPEN FIELD. (FSD)
2016-06-14 19:22:00+00:00,1922,UNK,7 S LAKE PARK,DICKINSON,IA,43.35,-95.32,TORNADO ON THE GROUND. (FSD)
2017-05-17 21:16:00+00:00,2116,UNK,4 W PLEASANT PLAIN,JEFFERSON,IA,41.15,-91.93,A RAPIDLY MOVING EF-1 TORNADO MOVED ALMOST DUE NORTH FROM ABOUT 4 MILES WEST OF PLEASANT PLAIN IN JEFFERSON COUNTY TO ABOUT 1.5 MILES WEST OF LAKE DARLING STATE PARK IN (DVN)
2017-03-07 04:05:00+00:00,0405,UNK,1 S MUSCATINE,MUSCATINE,IA,41.41,-91.07,*** 3 INJ *** 1005 PM TO 1010 PM. EF2. EST PEAK WIND 115 MPH. PATH LENGTH 1.8 MILES. MAX WIDTH 200 YARDS. END LOCATION 41.4245 N -91.0456 W. TORNADO TRACKED THROUGH MUS (DVN)
2016-10-07 03:19:00+00:00,0319,UNK,MUSCATINE,MUSCATINE,IA,41.42,-91.07,TRAINED SPOTTER REPORTED POSSIBLE TORNADO ON EAST SIDE OF MUSCATINE NEAR F-70 AND HIGHWAY 61. (DVN)
2017-03-07 04:13:00+00:00,0413,UNK,2 NE FAIRPORT,MUSCATINE,IA,41.45,-90.87,1013 PM TO 1036 PM. EF2. EST PEAK WIND 120 MPH. PATH LENGTH 25.3 MILES. MAX WIDTH 1000 YARDS. END LOCATION 2.9 E LONG GROVE OR 41.6932 N -90.4995 W. A TORNADO BEGAN IN (DVN)
2016-11-28 22:25:00+00:00,2225,UNK,1 E MONTEZUMA,POWESHIEK,IA,41.58,-92.5,CEDAR FALLS DISPATCH RELAYED REPORT FROM OFFICER OF A FUNNEL CLOUD SW OF HIS POSITION. AT THE TIME OF THE REPORT THE OFFICER WAS JUST SOUTH OF I-80 ON HIGHWAY 21 LOOKIN (DMX)
2016-11-28 22:19:00+00:00,2219,UNK,5 SSW MONTEZUMA,POWESHIEK,IA,41.52,-92.58,PICTURE OF CONFIRMED TORNADO TAKEN AT US 63 AND PARKIN AVE IN MAHASKA COUNTY LOOKING NORTH SENT IN FROM SPOTTER. TIME RADAR ESTIMATED. DELAYED REPORT. . (DMX)
2016-11-28 22:30:00+00:00,2230,UNK,1 ENE MONTEZUMA,POWESHIEK,IA,41.59,-92.51,PATROL OFFICER HAS CONFIRMED TORNADO ON THE GROUND... PERIODICALLY LIFTING AND THEN LOWERING AGAIN. OFFICER LOCATION AROUND I-80 AND HIGHWAY 21 LOOKING SW. REPORT RELAY (DMX)
2015-06-28 21:49:00+00:00,2149,UNK,MILTON,VAN BUREN,IA,40.67,-92.16,2 BRIEF TORNADO TOUCHDOWNS NEAR TOWN...QUICKLY LIFTED. (DVN)
2016-07-27 23:12:00+00:00,2312,UNK,4 W SCARVILLE,WINNEBAGO,IA,43.47,-93.7,MULTIPLE PHOTOS ON SOCIAL MEDIA SHOW FUNNEL EXTENDING CLOSE TO IF NOT TOUCHING THE GROUND. ESTIMATED LOCATION BASED ON PHOTOS AND RADAR. (DMX)
2015-07-16 22:55:00+00:00,2255,UNK,BURLINGTON,DES MOINES,IA,40.81,-91.12,POSSIBLE TORNADO OVER BURLINGTON MOVING TOWARD GULFPORT (DVN)
2016-04-27 20:17:00+00:00,2017,UNK,3 ENE STANTON,MONTGOMERY,IA,41.0,-95.05,TORNADO ON THE GROUND WITH DEBRIS. (OAX)
2015-05-11 01:20:00+00:00,0120,UNK,4 N MANSON,POCAHONTAS,IA,42.59,-94.54,TORNADO ON GROUND AND BOUNCING/GOING BACK UP IN CLOUD. (DMX)
2017-05-17 21:16:00+00:00,2116,UNK,7 NE WASHINGTON,WASHINGTON,IA,41.37,-91.6,AN EF-1 TORNADO SPUN UP AND TRACKED RAPIDLY TO THE NORTHEAST. THE TORNADO DAMAGED NUMEROUS FARM OUTBUILDINGS... POWER LINES... AND TREES ALONG THE PATH. THE PEAK WIND S (DVN)
2017-05-17 23:36:00+00:00,2336,UNK,7 NE WASHINGTON,WASHINGTON,IA,41.37,-91.6,AN EF-1 TORNADO SPUN UP AND TRACKED RAPIDLY TO THE NORTHEAST. THE TORNADO DAMAGED NUMEROUS FARM OUTBUILDINGS... POWER LINES... AND TREES ALONG THE PATH. THE PEAK WIND S (DVN)
2017-07-19 22:35:00+00:00,2235,UNK,2 WSW FORT ATKINSON,WINNESHIEK,IA,43.13,-91.98,DELAYED REPORT OF A TORNADO BETWEEN JACKSON JUNCTION AND FORT ATKINSON. TIME ESTIMATED FROM RADAR. (ARX)
2017-05-15 23:47:00+00:00,2347,UNK,2 WSW CALMAR,WINNESHIEK,IA,43.17,-91.91,TREE DAMAGE EVIDENCE OF A BRIEF LOW-END EF0 TORNADO IN THE LAKE MEYER AREA AND ALONG 265TH AVE FURTHER WEST. (ARX)
2016-08-04 22:30:00+00:00,2230,UNK,COUNCIL BLUFFS,POTTAWATTAMIE,IA,41.24,-95.86,TORNADO ON THE SOUTH SIDE OF COUNCIL BLUFFS. (OAX)
2016-06-29 23:22:00+00:00,2322,UNK,4 N UNDERWOOD,POTTAWATTAMIE,IA,41.44,-95.68,(OAX)
2016-07-01 01:12:00+00:00,0112,UNK,5 NE JEROME,JEROME,ID,42.77,-114.43,KMVT IN TWIN FALLS RELAYED A VIDEO SENT BY A CIVILIAN OF AN F0 TORNADO MOVING NORTHWEST TO SOUTHEAST ALONG A GUST FRONT FROM A THUNDERSTORM NORTHEAST OF JEROME.THE TORN (BOI)
2015-07-11 20:40:00+00:00,2040,UNK,HAMER,JEFFERSON,ID,43.93,-112.2,VIDEO RECEIVED WITH TORNADO OVER MUD LAKE. (PIH)
2017-11-17 21:26:00+00:00,2126,UNK,5 ENE IONA,BONNEVILLE,ID,43.56,-111.85,MULTIPLE REPORTS VIA BROADCAST MEDIA OF A TORNADO BETWEEN APPROXIMATELY 225PM AND 235PM ON THE BENCH BETWEEN IDAHO FALLS AND RIRIE. PRELIMINARY RATING OF EF0. (PIH)
2015-04-09 23:40:00+00:00,2340,UNK,2 NE FRANKLIN GROVE,LEE,IL,41.86,-89.27,VIEWED FROM I-88. DEBRIS SEEN. (LOT)
2015-06-23 00:28:00+00:00,0028,UNK,2 NW HARMON,LEE,IL,41.74,-89.59,EF-1 TORNADO WITH PEAK WINDS OF 105 MPH AND PATH LENGTH OF 7.5 MILES. MAINLY TREE DAMAGE. ENDING TIME OF 740 PM. (LOT)
2016-06-23 00:12:00+00:00,0012,UNK,5 ESE AMBOY,LEE,IL,41.7,-89.24,BRIEF TOUCHDOWN. (LOT)
2016-06-23 00:38:00+00:00,0038,UNK,COMPTON,LEE,IL,41.69,-89.09,TORNADO NEAR SHAW ROAD WITH TREE DAMAGE. (LOT)
2015-06-23 01:07:00+00:00,0107,UNK,SUBLETTE,LEE,IL,41.64,-89.23,CONFIRMED TORNADO. (LOT)
2015-06-23 00:53:00+00:00,0053,UNK,4 S AMBOY,LEE,IL,41.66,-89.32,*** 7 INJ *** EF-2 TORNADO WITH PEAK WINDS OF 130 MPH AND PATH LENGTH OF 7.8 MILES. THIS TORNADO SNAPPED OR UPROOTED MANY LARGE TREES IN THE WOODHAVEN LAKES CAMPING RES (LOT)
2015-04-09 23:43:00+00:00,2343,UNK,5 SE ASHTON,LEE,IL,41.82,-89.15,TORNARDO REPORTED DOING DAMAGE NEAR ASHTON. RELAYED BY DVN (LOT)
2015-05-09 23:36:00+00:00,2336,UNK,4 W BEAVER CREEK,BOND,IL,38.76,-89.47,BRIEF TOUCHDOWN (LSX)
2016-08-09 20:48:00+00:00,2048,UNK,3 E BERWYN,COOK,IL,41.85,-87.74,FAA CONTRACT OBSERVER FOR MIDWAY AIRPORT SPOTTED A LANDSPOUT TORNADO THAT HAD FORMED ON THE LAKE BREEZE. THE TORNADO DISSIPATED AT 358 PM CDT. LOCATION IS APPROXIMATE B (LOT)
2015-05-26 18:08:00+00:00,1808,UNK,SE SUMMIT,COOK,IL,41.78,-87.82,RATING: EF-0 ESTIMATED PEAK WIND: 75 MPH PATH LENGTH /STATUTE/: 0.4 MILES PATH WIDTH /MAXIMUM/: 50 YARDS FATALITIES: NONE INJURIES: NONE START DATE: 05/26/2015 START TI (LOT)
2017-05-24 01:05:00+00:00,0105,UNK,1 N MAQUON,KNOX,IL,40.81,-90.16,WEAK LANDSPOUT TORNADO IN A FIELD. (ILX)
2017-05-18 02:20:00+00:00,0220,UNK,2 SSW GALVA,KNOX,IL,41.14,-90.05,AN EF-2 TORNADO WITH PEAK ESTIMATED WIND SPEEDS OF 120 MPH CAUSED DAMAGE THAT WAS 50 YARDS WIDE ALSO ITS 1.29 MILE PATH. DAMAGE WAS TO TWO SNAPPED POWER POLES... ONE HO (DVN)
2015-08-03 01:38:00+00:00,0138,UNK,3 W GRAYSLAKE,LAKE,IL,42.35,-88.1,THIS IS FROM AUGUST 2ND. AN NWS STORM SURVEY TEAM CONFIRMED AN EF-1 TORNADO WITH ESTIMATED PEAK WINDS OF 90 TO 100 MPH. THE TORNADO PERSISTED FOR 7.5 MILES FROM ROUND L (LOT)
2015-08-03 01:50:00+00:00,0150,UNK,2 SSW GURNEE,LAKE,IL,42.35,-87.95,DELAYED REPORT. TORNADO WAS ON GROUND 1 MILE NORTHEAST OF SHERMAN CORNERS AND THEN LIFTED. TIME ESTIMATED BY RADAR. ALSO A CORROBORATING SPOTTER REPORT OF TORNADO ON GR (LOT)
2015-04-10 00:02:00+00:00,0002,UNK,5 N HILLCREST,OGLE,IL,42.02,-89.07,SEVERAL REPORTS OF A LARGE WEDGE TORNADO ON THE GROUND. (LOT)
2015-04-10 00:05:00+00:00,0005,UNK,11 NNE ROCHELLE,OGLE,IL,42.06,-88.98,RATING: EF-0 ESTIMATED PEAK WIND: 65 MPH PATH LENGTH /STATUTE/: 1.9 MILES PATH WIDTH /MAXIMUM/: 100 YARDS START DATE:APRIL 09 2015 START TIME:7:05 PM CDT START LOCATION (LOT)
2017-02-28 23:07:00+00:00,2307,UNK,5 SSE OREGON,OGLE,IL,41.95,-89.31,UPDATED FOR NWS STORM SURVEY INFORMATION. LOCATION AND TIME IS OF START OF TORNADO. THE MAXIMUM INTENSITY WAS EF-1 WITH ESTIMATED PEAK WINDS OF 90-95 MPH. THE PATH LENG (LOT)
2015-06-16 00:39:00+00:00,0039,UNK,5 ESE SYMERTON,WILL,IL,41.31,-87.96,(LOT)
2015-06-23 03:15:00+00:00,0315,UNK,BRAIDWOOD,WILL,IL,41.27,-88.22,I-55 BLOCKED IN BOTH DIRECTIONS IN BRAIDWOOD IL DUE TO DOWNED POWER LINES. (LOT)
2015-06-16 00:32:00+00:00,0032,UNK,1 ESE SYMERTON,WILL,IL,41.32,-88.04,EF-1 TORNADO RESULTED IN MULTIPLE LARGE TREES SNAPPED OR UPROOTED...STRUCTURAL DAMAGE TO FARM OUTBUILDINGS...AND MINOR DAMAGE TO SOME RESIDENCES ALONG ITS 4.23 MILE LON (LOT)
2015-08-19 00:55:00+00:00,0055,UNK,2 NW BOLINGBROOK,WILL,IL,41.72,-88.1,EF-0 TORNADO WITH MAXIMUM WINDS OF 70-80 MPH...PATH LENGTH OF 3.01 MILES AND PATH WIDTH OF 50-75 YARDS TRACKED FROM EXTREME SOUTHEAST NAPERVILLE TO EASTERN WOODRIDGE. S (LOT)
2015-06-23 03:20:00+00:00,0320,UNK,5 ESE BRAIDWOOD,WILL,IL,41.24,-88.13,IN CUSTER PARK. NEAR CURTIS ROAD AND GRAY ROAD. BARN DAMAGED. RELAYED FROM NWS PAH. (LOT)
2017-06-09 21:05:00+00:00,2105,UNK,BEECHER,WILL,IL,41.35,-87.61,TRAINED SPOTTER SENT VIDEO OF LAND SPOUT ON ROUTE 1 NEAR BEECHER LOOKING NORTH. (LOT)
2015-09-18 21:50:00+00:00,2150,UNK,5 S FRANKFORT,WILL,IL,41.42,-87.82,TORNADO SPOTTED FROM INTERSECTION OF GREEN GARDEN ROAD AND HARLEM (LOT)
2017-06-29 01:23:00+00:00,0123,UNK,2 SSE BELVIDERE,BOONE,IL,42.23,-88.83,AN EF-1 TORNADO WITH MAX WINDS AROUND 100 MPH TOUCHED DOWN WEST OF THE INTERSECTION OF HUBER AND GENOA RD AND LIFTED EAST OF THE INTERSECTION OF HUBER AND FERN HILL RD. (LOT)
2015-04-10 00:34:00+00:00,0034,UNK,BELVIDERE,BOONE,IL,42.25,-88.85,POSSIBLE TORNADO DAMAGE NEAR BELVIDERE. TIME BASED ON RADAR. (LOT)
2017-05-18 03:21:00+00:00,0321,UNK,2 S POPLAR GROVE,BOONE,IL,42.33,-88.82,AN NWS SURVEY TEAM CONFIRMED THAT AN EF-1 TORNADO TOUCHED DOWN APPROXIMATELY TWO MILES SOUTH OF POPLAR GROVE. THE TORNADO TRAVELED APPROXIMATELY 10.3 MILES AND LIFTED T (LOT)
2015-04-10 00:24:00+00:00,0024,UNK,3 S BELVIDERE,BOONE,IL,42.21,-88.84,RATING: EF-0 ESTIMATED PEAK WIND: 85 MPH PATH LENGTH /STATUTE/: 0.4 MILES PATH WIDTH /MAXIMUM/: 30 YARDS START DATE: APRIL 09 2015 START TIME:7:24 PM CDT START LOCATION (LOT)
2017-03-01 03:33:00+00:00,0333,UNK,VERSAILLES,BROWN,IL,39.88,-90.66,*** 1 INJ *** NWS STORM SURVEY TEAM FOUND DAMAGE IN VERSAILLES CONSISTENT WITH AN EF1 TORNADO. THE TORNADO WAS APPROXIMATELY 50 YARDS WIDE. THE PATH LENGTH WAS APPROXIM (LSX)
2016-09-09 23:46:00+00:00,2346,UNK,1 S CASEY,CLARK,IL,39.29,-87.99,BRIEF TOUCHDOWN. TIME ESTIMATED BY RADAR. (ILX)
2017-05-18 01:44:00+00:00,0144,UNK,NW HOOPPOLE,HENRY,IL,41.52,-89.91,PATH LENGTH 2 MILES...PATH WIDTH 50 YARDS. EF-1 RATING. (DVN)
2015-05-26 14:59:00+00:00,1459,UNK,6 SSW ATKINSON,HENRY,IL,41.34,-90.06,EF1 TORNADO WITH WINDS OF 100 MPH TRACKED FROM 6.75 MILES SOUTH-SOUTHWEST OF ATKINSON TO 3 MILES SOUTH OF ATKINSON. BEGAN AT 959 AM AND ENDED AT 1004 AM CDT. MAINLY DAM (DVN)
2017-05-18 02:20:00+00:00,0220,UNK,2 WSW GALVA,HENRY,IL,41.15,-90.08,*** 1 INJ *** CORRECTED COUNTY REFERENCE FROM KNOX TO HENRY. AN EF-2 TORNADO WITH PEAK ESTIMATED WIND SPEEDS OF 120 MPH CAUSED DAMAGE THAT HAD A MAXIMUM WIDTH OF 50 YAR (DVN)
2015-11-12 00:39:00+00:00,0039,UNK,4 N GENESEO,HENRY,IL,41.51,-90.15,TREES DAMAGED ALONG THE PATH. ONE LARGE MACHINE SHED DESTROYED AND A HOUSE PARTIALLY UNROOFED WHEN ITS PORCH WAS TORN OFF. PATH LENGTH WAS 4.75 MILES AND PATH WIDTH WAS (DVN)
2017-03-07 05:52:00+00:00,0552,UNK,2 NNW EASTON,MASON,IL,40.26,-89.86,PATH LENGTH 6.9 MILES... PEAK WIDTH 150 YARDS. MAX WIND 110 MPH. GREATEST DAMAGE OCCURRED AT A FARM 2.5 MILES NORTH OF EASTON... WHERE A MACHINE SHED WAS SEVERELY DAMAG (ILX)
2015-09-10 21:40:00+00:00,2140,UNK,2 SSE BATH,MASON,IL,40.16,-90.13,TORNADO ON THE GROUND FOR LESS THAN 30 SECONDS. ONE HOME WITH DAMAGE TO SIDING AND BRANCHES BLOWN THROUGH WINDOWS. MULTIPLE POWER LINES ALSO DOWN IN THE AREA. (ILX)
2017-11-18 18:15:00+00:00,1815,UNK,DU QUOIN,PERRY,IL,38.0,-89.24,EF-0 TORNADO STUCK EAST SIDE OF TOWN. EYEWITNESS REPORTS. BEGAN AT INTERSECTION OF DIVISION ST. AND EAST COLE ST. AND TRAVELED 0.65 MILES TO INTERSECTION OF HIDDEN LAKE (PAH)
2015-12-23 17:23:00+00:00,1723,UNK,4 E PINCKNEYVILLE,PERRY,IL,38.08,-89.31,EF-1 TORNADO. 95 MPH WINDS. PATH WIDTH 200 YARDS. PATH LENGTH 6 MILES FROM ABOUT 4.5 MILES EAST OF PINCKNEYVILLE TO NEAR TAMAROA. NUMEROUS TREES SNAPPED NEAR BASE OR UP (PAH)
2016-06-15 00:15:00+00:00,0015,UNK,3 WSW BRADFORD,STARK,IL,41.16,-89.71,TORNADO BRIEFLY TOUCHED DOWN IN FIELD. NO DAMAGE. (ILX)
2017-02-28 22:12:00+00:00,2212,UNK,5 SW BRADFORD,STARK,IL,41.13,-89.73,PATH LENGTH 5.51 MILES... PEAK WIDTH 100 YARDS... ESTIMATED PEAK WIND 95 MPH EF1. GREATEST DAMAGE WAS ON EAST SIDE OF CASTLETON WITH TREE DAMAGE AND DAMAGE TO A FEW HOM (ILX)
2017-03-01 03:54:00+00:00,0354,UNK,CROSSVILLE,WHITE,IL,38.16,-88.06,*** 1 FATAL *** DAMAGE REPORTED JUST SOUTH OF CROSSVILLE WITH 1 FATALITY. (PAH)
2017-03-01 03:54:00+00:00,0354,UNK,4 NE CARMI,WHITE,IL,38.13,-88.12,*** 1 FATAL... 2 INJ *** EF-3 TORNADO. MAX WIND 152 MPH. PATH LENGTH 44.6 MILES. MAX WIDTH 440 YARDS. BEGAN 4.2 MILES NE OF CARMI...IL AND CAME TO AN END 1.3 MILES SSE (PAH)
2015-06-19 20:13:00+00:00,2013,UNK,2 W NORRIS CITY,WHITE,IL,37.98,-88.36,TOUCHDOWN WEST OF NORRIS CITY...WENT FOUR AND A HALF MILES AND ENDED THREE AND A HALF MILES SSW OF ENFIELD. CORN BLOWN DOWN IN SEVERAL FIELDS. SEVERAL LARGE TREE LIMBS (PAH)
2017-03-01 03:46:00+00:00,0346,UNK,ENFIELD,WHITE,IL,38.1,-88.34,TORNADO ON THE GROUND. (PAH)
2015-06-19 20:25:00+00:00,2025,UNK,2 W NORRIS CITY,WHITE,IL,37.98,-88.36,TOUCHDOWN WEST OF NORRIS CITY...WENT FOUR AND A HALF MILES AND ENDED THREE AND A HALF MILES SSW OF ENFIELD. CORN BLOWN DOWN IN SEVERAL FIELDS. SEVERAL LARGE TREE LIMBS (PAH)
2017-03-01 03:46:00+00:00,0346,UNK,2 W CHERRY,BUREAU,IL,41.43,-89.25,AN EF-1 TORNADO TOUCHED DOWN 2 MILES WEST OF CHERRY AND DAMAGED MAINLY TREES ALONG ITS 2.34 MILE LONG PATH. A FARM SHED WAS ALSO COMPLETELY DESTROYED. THE TORNADO LIFTE (DVN)
2016-06-23 00:55:00+00:00,0055,UNK,LA MOILLE,BUREAU,IL,41.53,-89.28,TORNADO BRIEFLY TOUCHED DOWN AND THEN LIFTED (DVN)
2016-06-23 01:33:00+00:00,0133,UNK,1 SSE MALDEN,BUREAU,IL,41.41,-89.36,DELAYED REPORT. TORNADO DID DAMAGE TO A RESIDENCE WITH TREE DAMAGE ALSO FOUND. TORNADO WAS ON THE GROUND FROM 833 PM TO 837 PM. CATEGORY WAS EF0. (DVN)
2016-06-23 01:07:00+00:00,0107,UNK,3 N MANLIUS,BUREAU,IL,41.5,-89.67,BRIEF TORNADO - FUNNEL HAS LIFTED (DVN)
2017-03-07 06:14:00+00:00,0614,UNK,N LADD,BUREAU,IL,41.38,-89.21,(DVN)
2016-06-23 00:40:00+00:00,0040,UNK,5 W LA MOILLE,BUREAU,IL,41.52,-89.38,TORNADO BRIEFLY TOUCHED DOWN AND THEN LIFTED. IT LASTED FROM 740 PM TO 742 PM. (DVN)
2015-08-19 01:06:00+00:00,0106,UNK,ENE DOWNERS GROVE,DUPAGE,IL,41.8,-88.01,BRIEF...WEAK EF-0 TORNADO WITH MAXIMUM WINDS OF 65-70 MPH...PATH LENGTH OF 0.25 MILES AND PATH WIDTH OF 50-75 YARDS. A FEW HARDWOOD TREES SNAPPED...ONE SNAPPED A POWERP (LOT)
2017-02-28 23:13:00+00:00,2313,UNK,2 NW MORRIS,GRUNDY,IL,41.39,-88.46,STORM CHASER REPORTS VERY LARGE TORNADO 2 MILES NORTHWEST OF MORRIS. (LOT)
2015-06-23 02:43:00+00:00,0243,UNK,4 NE MAZON,GRUNDY,IL,41.28,-88.38,EF-1 TORNADO WITH PEAK WINDS OF 95 MPH AND PATH LENGTH OF 0.8 MILES. A PORTION OF A HOUSE ROOF WAS BLOWN OFF AND A LARGE TREE SNAPPED. ENDING TIME OF 946 PM. (LOT)
2015-06-23 02:58:00+00:00,0258,UNK,1 S COAL CITY,GRUNDY,IL,41.27,-88.28,CONFIRMED TORNADO. MULTIPLE TREES DOWN NEAR I-55/COAL CITY EXIT. (LOT)
2016-06-23 02:29:00+00:00,0229,UNK,3 ENE MAZON,GRUNDY,IL,41.27,-88.37,(LOT)
2016-05-10 22:56:00+00:00,2256,UNK,2 ESE KARBERS RIDGE,HARDIN,IL,37.57,-88.3,EF0 PEAK WIND SPEED 75 MPH. BRIEF TOUCHDOWN WITH SOME TREE DAMAGE. (PAH)
2017-04-29 21:02:00+00:00,2102,UNK,2 W MILES STATION,JERSEY,IL,39.08,-90.15,A WEAK TORNADO CAUSED DAMAGE TO TREES AND THREE RESIDENCES NEAR THE JERSEY/MACOUPIN COUNTY BORDER. THE DAMAGE WAS RATED EF1 WITH MAXIMUM WINDS OF 90 MPH AND A WIDTH OF (LSX)
2017-11-18 19:38:00+00:00,1938,UNK,1 S ROUND KNOB,MASSAC,IL,37.21,-88.73,EF-0 TORNADO WITH PEAK WINDS OF 65 MPH BRIEFLY TOUCHED DOWN. SNAPPED A CEDAR TREE ALONG WITH SHINGLE DAMAGE TO RESIDENCE AND BROKE LIMBS OFF SEVERAL TREES. TIME ESTIMAT (PAH)
2015-06-08 01:22:00+00:00,0122,UNK,8 E PETERSBURG,MENARD,IL,40.01,-89.7,TREES BLOWN DOWN 8 MILES EAST OF PETERSBURG. (ILX)
2015-06-11 22:25:00+00:00,2225,UNK,5 NNE ALEDO,MERCER,IL,41.27,-90.71,CONFIRMED EF1 TORNADO...DEVELOPED 5 NNE OF ALEDO OR 5.3 W OF MATHERVILLE...PEAK WINDS 100 MPH...PATH LENGTH 6 MILES...PATH WIDTH 50 YARDS. THIS TORNADO CAUSED THE DAMAG (DVN)
2015-06-11 22:31:00+00:00,2231,UNK,2 SSE REYNOLDS,MERCER,IL,41.31,-90.66,TREES AND POWERLINES DOWN 1 MILE SOUTH OF 170TH AVE. RADAR CONFIRMED TORNADO DEBRIS SIGNATURE. PRELIMINARY REPORT...SURVEY TEAM WILL INVESTIGATE TOMORROW. (DVN)
2015-05-24 23:55:00+00:00,2355,UNK,3 NE MUSCATINE,MERCER,IL,41.3,-90.97,A BRIEF TORNADO TOUCH DOWN JUST SOUTHWEST OF ELIZA. (DVN)
2017-05-18 01:00:00+00:00,0100,UNK,3 SE SHERRARD,MERCER,IL,41.29,-90.46,PATH LENGTH 8 MILES...PATH WIDTH 150 YARDS. EF-1 RATING. (DVN)
2017-04-29 21:20:00+00:00,2120,UNK,3 NE ALEXANDER,MORGAN,IL,39.75,-90.01,A TORNADO BRIEFLY TOUCHED DOWN IN AN OPEN FIELD (ILX)
2015-04-09 18:37:00+00:00,1837,UNK,3 W ROME,PEORIA,IL,40.88,-89.57,BRIEF ROPE TORNADO (ILX)
2017-07-10 10:42:00+00:00,1042,UNK,2 S PRINCEVILLE,PEORIA,IL,40.9,-89.76,BRIEFLY TOUCHED DOWN IN FIELD. LARGE ROTATING WALL CLOUD BECOMING RAIN WRAPPED. (ILX)
2016-03-16 01:05:00+00:00,0105,UNK,PEORIA,PEORIA,IL,40.74,-89.61,TORNADO STARTED 4 MILES NW OF DOWNTOWN PEORIA. DAMAGE WAS DONE TO AN ASSISTED LIVING CENTER... HOUSE ROOFS... TREES... A SHOPPING CENTER... AND GOLF COURSE AS IT TRACKED NORT
2017-07-10 22:42:00+00:00,2242,UNK,2 S PRINCEVILLE,PEORIA,IL,40.9,-89.76,BRIEFLY TOUCHED DOWN IN FIELD. LARGE ROTATING WALL CLOUD BECOMING RAIN WRAPPED. CORRECTED TIME. (ILX)
2016-03-16 00:42:00+00:00,0042,UNK,2 NW TRIVOLI,PEORIA,IL,40.71,-89.91,A CAR WAS PICKED UP AND THROWN 50 YARDS INTO A FIELD. ROOF DAMAGE TO SEVERAL HOMES AND A CHURCH. ROOF COMPLETELY TORN OFF ONE HOUSE. NUMEROUS TREES WERE SNAPPED. (ILX)
2015-04-09 18:32:00+00:00,1832,UNK,8 SW CHILLICOTHE,PEORIA,IL,40.84,-89.61,TORNADO ON THE GROUND MOVING ENE. COULD SEE THE FUNNEL CLOUD AND SOME DEBRIS ON THE GROUND... BUT THE MIDDLE OF THE TORNADO WAS INVISIBLE. IT WAS MOVING TOWARDS CHILLICOT (IL
2016-03-16 00:50:00+00:00,0050,UNK,4 N HANNA CITY,PEORIA,IL,40.75,-89.79,HOUSE DAMAGED...ROOF BLOWN OFF (ILX)
2016-07-18 01:18:00+00:00,0118,UNK,5 SSW HENNEPIN,PUTNAM,IL,41.19,-89.36,BRIEF TOUCHDOWN REPORTED BY FIRE CHIEF. TIME ESTIMATED. (DVN)
2017-02-28 22:30:00+00:00,2230,UNK,3 W CEDAR POINT,PUTNAM,IL,41.26,-89.18,(LOT)
2016-07-18 01:24:00+00:00,0124,UNK,1 SSE FLORID,PUTNAM,IL,41.22,-89.28,BRIEF TOUCHDOWN. FUNNEL WENT UP AND DOWN. (DVN)
2016-05-10 22:26:00+00:00,2226,UNK,RUDEMENT,SALINE,IL,37.64,-88.49,BRIEF TORNADO TOUCHDOWN. (PAH)
2015-07-17 00:30:00+00:00,0030,UNK,CAMERON,WARREN,IL,40.88,-90.52,(DVN)
2015-07-16 23:50:00+00:00,2350,UNK,3 SSW KIRKWOOD,WARREN,IL,40.83,-90.77,RATING EF-1. ESTIMATED PEAK WIND 90 MPH. PATH LENGTH 1.4 MILES. MAX WIDTH 50 YARDS. START TIME 650 PM CDT. START LOCATION 2.5 MILES SW KIRKWOOD IL. END TIME 652 PM CDT. (DVN)
2016-05-09 22:43:00+00:00,2243,UNK,1 S GREENBUSH,WARREN,IL,40.7,-90.53,BRIEF TORNADO TOUCHDOWN. NO DAMAGE. (DVN)
2015-07-16 23:59:00+00:00,2359,UNK,KIRKWOOD,WARREN,IL,40.87,-90.75,TORNADO STILL ON GROUND MOVING EAST...A FEW FUNNEL CLOUDS ALSO SEEN. (DVN)
2015-07-17 00:04:00+00:00,0004,UNK,MONMOUTH,WARREN,IL,40.91,-90.64,POSSIBLE TORNADO NEAR US 34 (DVN)
2015-07-17 00:09:00+00:00,0009,UNK,2 E KIRKWOOD,WARREN,IL,40.87,-90.71,RATING EF-2. ESTIMATED PEAK WIND 120 MPH. PATH LENGTH 1.7 MILES. MAX WIDTH 300 YARDS. START TIME 709 PM CDT. START LOCATION 2 MILES E KIRKWOOD IL. END TIME 713 PM CDT. (DVN)
2015-04-10 00:15:00+00:00,0015,UNK,4 NW KIRKLAND,DE KALB,IL,42.13,-88.91,TIME BASED ON RADAR. DAMAGE TO HOUSES AND LARGE TREES UPROOTED. (LOT)
2015-04-10 00:10:00+00:00,0010,UNK,4 W KIRKLAND,DE KALB,IL,42.09,-88.93,TOUCHDOWN BETWEEN MONROE CENTER AND FAIRDALE NEAR OGLE DEKALB COUNTY LINE. DAMAGE REPORTED. (LOT)
2017-10-14 23:25:00+00:00,2325,UNK,1 W BOWEN,HANCOCK,IL,40.23,-91.08,A BRIEF EF-0 TORNADO TOUCHED DOWN JUST WEST OF TOWN. DAMAGE WAS MAINLY TO TREES IN THE AREA. PEAK WIND WAS 80 MPH WITH A PATH LENGTH OF 0.8 MI. MAX WIDTH WAS 25 YARDS. (DVN)
2016-03-15 22:52:00+00:00,2252,UNK,3 SE WARSAW,HANCOCK,IL,40.32,-91.39,TORNADO OBSERVED 2 TO 3 MILES SOUTHEAST OF WARSAW AT CORNER OF HIGHWAY 11 AND 136. IT HAS LIFTED....WAS A HIGH BASED CONE WITH A SMALL DEBRIS FIELD FOR A BIT. (DVN)
2017-03-01 04:25:00+00:00,0425,UNK,8 WSW CARBONDALE,JACKSON,IL,37.68,-89.35,EF-0 TORNADO NEAR CARBONDALE... IL. PEAK WIND 75 MPH. PATH LENGTH 4.1 MILES. MAX WIDTH 25 YRDS. BEGAN 8.4 MILES WSW OF CARBONDALE IL AND ENDED 4.5 MILES WEST OF COMMUNI (PAH)
2015-06-19 21:53:00+00:00,2153,UNK,1 E MURPHYSBORO,JACKSON,IL,37.77,-89.32,BRIEF TOUCHDOWN JUST NORTH OF ILLINOIS ROUTE 13 JUST EAST OF THE BIG MUDDY RIVER. ROOF OFF WOODEN COMMERCIAL BUILDING. TWO PONTOONS LOFTED OR FLIPPED. TWO POWER POLES S (PAH)
2017-03-01 02:30:00+00:00,0230,UNK,AVA,JACKSON,IL,37.89,-89.5,TORNADO ON THE GROUND. REPORTED BY OFF-DUTY STATE TROOPER. WIDESPREAD HOME AND TREE DAMAGE THROUGHOUT THE COMMUNITY. (PAH)
2017-03-01 02:45:00+00:00,0245,UNK,1 N ELKVILLE,JACKSON,IL,37.92,-89.24,HOMES DESTROYED NORTH OF ELKVILLE. U.S. 51 NORTH OF TOWN IMPASSIBLE. (PAH)
2017-03-01 10:08:00+00:00,1008,UNK,8 WSW CARBONDALE,JACKSON,IL,37.68,-89.35,EF-0 TORNADO NEAR CARBONDALE... IL. PEAK WIND 75 MPH. PATH LENGTH 4.1 MILES. MAX WIDTH 25 YRDS. BEGAN 8.4 MILES WSW OF CARBONDALE IL AND ENDED 4.5 MILES WEST OF COMMUNI (PAH)
2017-03-01 02:19:00+00:00,0219,UNK,2 SE ROCKWOOD,JACKSON,IL,37.82,-89.67,TORNADO ON THE GROUND. POWER FLASHES. (PAH)
2017-03-01 02:42:00+00:00,0242,UNK,4 S VERGENNES,JACKSON,IL,37.84,-89.34,LAREGE TORNADO ON THE GROUND CROSSING STATE ROUTE 4. WIDESPREAD HOME AND TREE DAMAGE REPORTED BY LAW ENFORCEMENT. (PAH)
