timestamp,time,f_scale,location,county,state,latitude,longitude,comments
2015-07-18 07:02:00+00:00,0702,UNK,6 SE THEILMAN,WABASHA,MN,44.24,-92.09,DAMAGE TO A FARM INCLUDED SILO TOPS REMOVED...GARAGE DOORS BLOWN IN...TIRES MOVED. 25 YD WIDE...100 YARD LONG PATH THROUGH CORN SHOWED WEAK TORNADO TRACK. TIME IS RADAR (ARX)
2016-07-06 01:42:00+00:00,0142,UNK,1 W WABASHA,WABASHA,MN,44.37,-92.07,REPORTS OF TORNADO ON THE GROUND FROM SPOTTER NEAR CR 10 AND CR 77 JUST WEST OF WABASHA IN PEPIN TOWNSHIP. (ARX)
2017-05-17 21:29:00+00:00,2129,UNK,1 WSW PLAINVIEW,WABASHA,MN,44.16,-92.18,AN EF-0 TORNADO TOUCHED DOWN IN PLAINVIEW MINNESOTA AT 429 PM ON WEDNESDAY MAY 17TH. THE TORNADO PRODUCED SPOTTY MINOR DAMAGE ALONG A 0.6 MILE PATH. MAXIMUM WIDTH WAS 3 (ARX)
2017-05-18 00:35:00+00:00,0035,UNK,S ELGIN,WABASHA,MN,44.13,-92.25,AN EF-0 TORNADO TOUCHED DOWN IN ELGIN MINNESOTA ON THE EVENING OF MAY 17TH. THE TORNADO PRODUCED A SHORT PATH OF MAINLY TREE AND ROOF SHINGLE DAMAGE THROUGH THE CITY. T (ARX)
2017-07-21 20:45:00+00:00,2045,UNK,8 W KELLIHER,BELTRAMI,MN,47.94,-94.62,MULTIPLE BRIEF TOUCHDOWNS OBSERVED OVER A HALF MINUTE PERIOD. GRAIN BINS AND OTHER FARM BUILDINGS DAMAGED. (FGF)
2016-09-09 23:24:00+00:00,2324,UNK,7 E REDBY,BELTRAMI,MN,47.88,-94.76,THUNDERSTORMS PRODUCED A WATERSPOUT-TYPE TORNADO ON THE FAR SOUTHEAST CORNER OF LOWER RED LAKE. PICTURES AND VIDEO INDICATE THAT THIS TORNADO STAYED MAINLY OVER OPENED (FGF)
2016-07-20 02:14:00+00:00,0214,UNK,4 NNW PUPOSKY,BELTRAMI,MN,47.73,-94.94,A TORNADO PARTIALLY WRAPPED IN HEAVY RAINS AND DOWNBURST WINDS TRACKED TO THE EAST SOUTHEAST FOR ROUGHLY 4 MILES ...TO AROUND 4 ENE OF PUPOSKY AND THE BUENA VISTA STATE (FGF)
2015-05-16 21:35:00+00:00,2135,UNK,5 NE WATSON,CHIPPEWA,MN,45.05,-95.72,TRAINED SPOTTER REPORTED TORNADO TOUCHDOWN NORTH OF MONTEVIDEO. LAW ENFORCEMENT REPORTED PART OF ROOF BLOWN OFF BUILDING AT A FARMSTEAD 1 MILE WEST OF HWY 29 ABOUT 7 MI (MPX)
2017-03-06 23:38:00+00:00,2338,UNK,CLARKS GROVE,FREEBORN,MN,43.76,-93.33,EF1 TORNADO SURVEYED IN FREEBORN COUNTY. PEAK WINDS 100 TO 110 MPH. PATH LENGTH 12.3 MILES. (MPX)
2016-08-18 21:31:00+00:00,2131,UNK,HOLLANDALE,FREEBORN,MN,43.76,-93.21,DAMAGE PHOTOS FROM KAAL-TV BROADCAST METEOROLOGIST CLEARLY SHOW TORNADIC DAMAGE TO A CORN FIELD AND TREES ON THE NORTHWEST CORNER OF HWY 251 AND ZUYDER ZEE AVE. TORNADO (MPX)
2016-06-14 21:32:00+00:00,2132,UNK,2 ESE KILKENNY,LE SUEUR,MN,44.3,-93.53,TWISTER SEEN 6 MILES NNE OF WATERVILLE. (MPX)
2016-06-14 21:02:00+00:00,2102,UNK,1 S WATERVILLE,LE SUEUR,MN,44.2,-93.57,TORNADO MOVING ENE. (MPX)
2017-08-17 00:05:00+00:00,0005,UNK,1 SW NEW PRAGUE,LE SUEUR,MN,44.54,-93.59,WEAK TORNADO DEVELOPED SOUTH SOUTHWEST OF NEW PRAGUE. DAMAGE MATCHED UP TO CIRCULATION ON RADAR. (MPX)
2015-06-22 07:26:00+00:00,0726,UNK,1 S MAHNOMEN,MAHNOMEN,MN,47.3,-95.97,A TORNADO TRACKED ACROSS FAR SOUTHERN MAHNOMEN FOR ROUGHLY 400 YARDS OVER A 30 TO 40 SECOND PERIOD. THIS TORNADO RIPPED ROOFING OFF OF A MAINTENANCE SHED... LIFTED AND (FGF)
2016-09-08 03:34:00+00:00,0334,UNK,3 NW CAMP RIPLEY JUNCTI,MORRISON,MN,46.1,-94.37,RATED EF 1 ESTIMATED MAXIMUM WIND SPEED 90 MPH. SEVERAL BUILDINGS DAMAGED... BOATS FLIPPED AND TREES UPROOTED. . (MPX)
2017-08-16 22:13:00+00:00,2213,UNK,3 S NICOLLET,NICOLLET,MN,44.24,-94.19,REPORTED BY STORM SPOTTER LOCATED ABOUT 3 MILES SOUTH OF NICOLLET ON HWY 23. (MPX)
2017-08-16 22:42:00+00:00,2242,UNK,3 N NEW SWEDEN,NICOLLET,MN,44.45,-94.2,TORNADO REPORTED NEAR SIBLEY AND NICOLLET CO BORDER NEAR HWY 22... NORTH OF NEW SWEDEN. (MPX)
2017-08-16 21:52:00+00:00,2152,UNK,1 E NICOLLET,NICOLLET,MN,44.28,-94.17,REPORTED BY COUNTY DISPATCH CENTER. OBSERVED NEAR HWY 99 JUST EAST OF NICOLLET. (MPX)
2017-08-16 21:58:00+00:00,2158,UNK,1 S NICOLLET,NICOLLET,MN,44.26,-94.19,"6"" TREE BRANCHES DOWN AND STREET SIGNS BENT OVER ABOUT 1 MILE S OF NICOLLET. (MPX)"
2017-08-16 22:35:00+00:00,2235,UNK,1 N NEW SWEDEN,NICOLLET,MN,44.42,-94.19,TORNADO REPORTED BY SKYWARN JUST NORTH OF NEW SWEDEN NEAR INTERSECTION OF HWY 22 AND CO ROAD 111. (MPX)
2016-05-27 19:10:00+00:00,1910,UNK,4 E BROOKS,RED LAKE,MN,47.82,-95.91,BRIEF TOUCHDOWN BETWEEN BROOKS AND OKLEE. DUST SWIRL. NO DAMAGE. (FGF)
2016-06-14 22:50:00+00:00,2250,UNK,4 NNE BARRY,TRAVERSE,MN,45.61,-96.53,TORNADO LASTED FOR APPROXIMATELY 30 SECONDS. (ABR)
2017-06-14 01:30:00+00:00,0130,UNK,2 NW JOHNSON,TRAVERSE,MN,45.6,-96.33,RESIDENT SAW THE TORNADO TOUCHDOWN... SIGNIFICANT TREE DAMAGE ON THE PROPERTY... TIME RADAR ESTIMATED. (ABR)
2015-07-24 23:40:00+00:00,2340,UNK,8 SSW ST JAMES,WATONWAN,MN,43.88,-94.69,PHOTO OF A BRIEF LANDSPOUT TORNADO RECEIVED VIA TWITTER. RELAYED BY KEYC BROADCAST METEOROLOGIST. (MPX)
2016-06-14 22:26:00+00:00,2226,UNK,2 W BARRY,BIG STONE,MN,45.56,-96.6,SHERIFF REPORTED A TORNADO ON THE GROUND 2 MILES WEST OF BARRY. (ABR)
2017-06-14 01:27:00+00:00,0127,UNK,2 W GRACEVILLE,BIG STONE,MN,45.57,-96.48,SHORT LIVED. (ABR)
2016-06-14 22:10:00+00:00,2210,UNK,5 SE BEARDSLEY,BIG STONE,MN,45.51,-96.64,THIN ROPE TORNADO BRIEFLY TOUCHED DOWN AROUND 510 PM. 3 TO 5 MILES SOUTHEAST OF BEARDSLEY. (ABR)
2016-04-25 00:31:00+00:00,0031,UNK,1 S DELAVAN,FARIBAULT,MN,43.75,-94.02,MULTIPLE REPORTS OF A BRIEF TORNADO TOUCHDOWN SOUTH OF DELAVAN. (MPX)
2017-03-06 22:04:00+00:00,2204,UNK,1 NNW BRICELYN,FARIBAULT,MN,43.58,-93.82,EF1 TORNADO SURVEYED IN FARIBAULT COUNTY. PEAK WINDS 90 MPH. PATH LENGTH 9.6 MILES. (MPX)
2016-04-25 00:45:00+00:00,0045,UNK,BRICELYN,FARIBAULT,MN,43.56,-93.81,PHOTO OF A BRIEF TORNADO TOUCHDOWN IN BRICELYN SENT VIA SOCIAL MEDIA. (MPX)
2015-08-06 22:59:00+00:00,2259,UNK,HAWICK,KANDIYOHI,MN,45.31,-94.81,BRIEF TOUCHDOWN (MPX)
2015-08-06 21:58:00+00:00,2158,UNK,2 N NORWAY LAKE,KANDIYOHI,MN,45.34,-95.13,CONFIRMED TOUCH DOWN (MPX)
2015-08-06 23:06:00+00:00,2306,UNK,HAWICK,KANDIYOHI,MN,45.31,-94.81,REPORT OF DAMAGE TO ROOF...DEBRIS IN THE AIR (MPX)
2016-06-14 18:59:00+00:00,1859,UNK,2 NE PIPESTONE,PIPESTONE,MN,44.02,-96.29,TORNADO LIFTED OFF THE GROUND. (FSD)
2016-06-03 22:35:00+00:00,2235,UNK,6 W HOLLAND,PIPESTONE,MN,44.1,-96.31,BRIEF LANDSPOUT. (FSD)
2016-06-14 18:52:00+00:00,1852,UNK,1 NW PIPESTONE,PIPESTONE,MN,44.01,-96.33,TORNADO ON THE GROUND. (FSD)
2017-03-06 23:39:00+00:00,2339,UNK,2 ESE ORROCK,SHERBURNE,MN,45.43,-93.69,EF1 TORNADO SURVEYED IN SHERBURNE COUNTY. PEAK WINDS 100 TO 110 MPH. PATH LENGTH 8.9 MILES. (MPX)
2017-07-10 03:35:00+00:00,0335,UNK,2 SW JUDSON,BLUE EARTH,MN,44.18,-94.22,LAW ENFORCEMENT REPORTING A TORNADO NEAR THE INTERSECTION OF CR 20 & MN HWY 68. (MPX)
2016-06-14 20:34:00+00:00,2034,UNK,2 SSW VERNON CENTER,BLUE EARTH,MN,43.94,-94.18,MULTIPLE REPORTS FROM LAW ENFORCEMENT. TORNADO TOUCHED DOWN FOR A SHORT PERIOD OF TIME THEN WENT BACK UP. (MPX)
2017-08-16 21:20:00+00:00,2120,UNK,6 W LAKE CRYSTAL,BLUE EARTH,MN,44.11,-94.33,VIDEO ON SOCIAL MEDIA SHOWED TORNADO AT 4:20 PM CDT ON HWY 30 JUST NORTH OF HWY 60. RADAR SUPPORTS THIS REPORT. (MPX)
2017-07-10 03:25:00+00:00,0325,UNK,2 NW LAKE CRYSTAL,BLUE EARTH,MN,44.12,-94.25,MULTIPLE SPOTTER REPORTS OF A TORNADO 2 MILES NW OF LAKE CRYSTAL. (MPX)
2017-05-17 21:12:00+00:00,2112,UNK,3 SSW SKYLINE,BLUE EARTH,MN,44.1,-94.07,VIA EMERGENCY MANAGER FROM PUBLIC. (MPX)
2015-07-12 22:48:00+00:00,2248,UNK,5 N VINING,OTTER TAIL,MN,46.34,-95.53,BETWEEN OTTER TAIL AND VINING. (FGF)
2015-05-16 21:25:00+00:00,2125,UNK,5 N NASSAU,LAC QUI PARLE,MN,45.13,-96.43,TRAINED SPOTTER REPORTED TORNADO TOUCH DOWN FOR ABOUT TWO MINUTES NEAR ROSEN. NO DAMAGE REPORTED SO FAR. (MPX)
2015-09-19 00:14:00+00:00,0014,UNK,1 NW FREEMAN,CASS,MO,38.63,-94.52,TORNADO REPORTED AT 269TH AND MISSOURI 2 HIGHWAY WITH NEARBY STRUCTUAL DAMAGE. (EAX)
2015-07-02 01:05:00+00:00,0105,UNK,SE PLEASANT HILL,CASS,MO,38.79,-94.27,SPOTTER REPORTS TORNADO ON GROUND AT HWY 7 AND HWY 58. (EAX)
2015-09-19 00:08:00+00:00,0008,UNK,FREEMAN,CASS,MO,38.62,-94.51,TORNADO REPORTED IN FREEMAN WITH DAMAGE TO ROOFTOPS (EAX)
2015-09-19 00:33:00+00:00,0033,UNK,HARRISONVILLE,CASS,MO,38.65,-94.35,TORNADO REPORTED EAST OF HARRISONVILLE (EAX)
2015-09-19 00:02:00+00:00,0002,UNK,1 NW FREEMAN,CASS,MO,38.63,-94.52,TORNADO REPORTED AT MISSOURI HIGHWAY 2 NEAR MIDWAY ELEMENTARY SCHOOL. (EAX)
2017-03-07 00:27:00+00:00,0027,UNK,2 S TRIMBLE,CLAY,MO,39.45,-94.57,POSSIBLE TORNADO DAMAGE. 8-12 HOUSES DAMAGED. 4-5 ARE UNINHABITABLE... THE REST HAVE MINOR DAMAGE. . (EAX)
2015-07-06 22:16:00+00:00,2216,UNK,3 N COURTNEY,CLAY,MO,39.2,-94.39,(EAX)
2015-07-06 22:04:00+00:00,2204,UNK,2 N GLENAIRE,CLAY,MO,39.24,-94.46,DEBRIS REPORTED WITH THE STORM. (EAX)
2015-07-06 22:09:00+00:00,2209,UNK,1 SW LIBERTY,CLAY,MO,39.24,-94.43,(EAX)
2017-03-07 01:27:00+00:00,0127,UNK,2 S TRIMBLE,CLAY,MO,39.45,-94.57,POSSIBLE TORNADO DAMAGE. 8-12 HOUSES DAMAGED. 4-5 ARE UNINHABITABLE... THE REST HAVE MINOR DAMAGE. . (EAX)
2017-05-19 21:12:00+00:00,2112,UNK,2 ENE EVERTON,DADE,MO,37.36,-93.67,A BRIEF EF-0 RATED TORNADO OCCURRED 2 MILES ENE OF EVERTON. DAMAGE WAS LIMITED TO SEVERAL TREES ON EITHER SIDE OF E DADE RD 152. THE PATH WAS APPROXIMATELY 1/2 MILE LON (SGF)
2017-05-19 21:05:00+00:00,2105,UNK,3 SE EVERTON,DADE,MO,37.31,-93.66,A BRIEF EF-0 RATED TORNADO OCCURRED 3 MILES SOUTHEAST OF EVERTON IN DADE COUNTY ALONG DADE RD 231. MULTIPLE TREES WERE DAMAGED ALONG A PATH IN THE AREA. THE PATH WAS AP (SGF)
2017-03-30 04:00:00+00:00,0400,UNK,4 SW SLIGO,DENT,MO,37.74,-91.44,NWS STORM SURVEY FOUND EF-1 RATED TORNADO DAMAGE NEAR THE SHORT BEND AREA OF NORTHEASTERN DENT COUNTY... OR ABOUT 9 MILES NE OF SALEM... MO. MAXIMUM WINDS WERE ESTIMATE (SGF)
2017-03-07 00:17:00+00:00,0017,UNK,1 WSW MOUND CITY,HOLT,MO,40.13,-95.26,HOLT COUNTY SHERIFF DEPT RELAYED REPORT FROM MOUND CITY FIRE DEPT OF A BRIEF TORNADO JUST WEST OF MOUND CITY. (EAX)
2017-03-06 23:17:00+00:00,2317,UNK,1 WSW MOUND CITY,HOLT,MO,40.13,-95.26,HOLT COUNTY SHERIFF DEPT RELAYED REPORT FROM MOUND CITY FIRE DEPT OF A BRIEF TORNADO JUST WEST OF MOUND CITY. (EAX)
2016-04-28 00:48:00+00:00,0048,UNK,4 NNW BARING,KNOX,MO,40.3,-92.23,BRIEF EF1 TORNADO WITH WINDS OF 90 MPH OCCURRED ON THE KNOX AND SCOTLAND COUNTY LINE. A MANUFACTURED HOME WAS BLOWN OFF ITS BRICKS AND DESTROYED. A DOOR ON A BARN WAS R (LSX)
2015-06-28 23:26:00+00:00,2326,UNK,1 S EDGEWOOD,PIKE,MO,39.26,-91.08,TORNADO ON THE GROUND...BUT HAS BECOME RAIN WRAPPED. SPOTTER WAS NEAR INTERSECTION OF HIGHWAYS HH AND Z IN NORTHERN LINCOLN COUNTY LOOKING TO THE NORTH. (LSX)
2015-05-17 07:11:00+00:00,0711,UNK,6 E HUMANSVILLE,POLK,MO,37.78,-93.47,A NWS STORM SURVEY FOUND AN EF-0 TORNADO BRIEFLY TOUCHED DOWN SOUTHEAST OF FLEMINGTON. THE TORNADO TOUCHED DOWN NEAR SOUTH 85TH ROAD AND 330TH ROAD AND LIFTED NEAR SOUT (SGF)
2015-05-17 07:07:00+00:00,0707,UNK,4 E DUNNEGAN,POLK,MO,37.7,-93.5,AN EF0 RATED TORNADO OCCURRED EAST OF DUNNEGAN DURING THE EARLY MORNING HOURS OF MAY 17. MULTIPLE TREES WERE DAMAGED IN THE AREA...WITH DAMAGE CONSISTENT WITH WINDS OF (SGF)
2015-05-17 07:16:00+00:00,0716,UNK,4 W POLK,POLK,MO,37.73,-93.38,A NWS STORM SURVEY FOUND AN EF-0 TORNADO BRIEFLY TOUCHED DOWN ABOUT 4 MILES WEST OF POLK NEAT E 358TH ROAD AND HWY PP. IT TRAVELED NORTHEAST AND LIFTED APPROXIMATELY 2 (SGF)
2017-05-19 21:19:00+00:00,2119,UNK,3 WNW WALNUT GROVE,POLK,MO,37.43,-93.59,AN EF0 TORNADO OCCURRED ALONG THE GREENE/POLK COUNTY LINE WNW OF WALNUT GROVE ON THE AFTERNOON OF MAY 19. DAMAGE INCLUDED SEVERAL UPROOTED TREES AND DAMAGE TO AN OUTBUI (SGF)
2017-03-10 00:43:00+00:00,0043,UNK,2 ENE BUTTERFIELD,BARRY,MO,36.77,-93.87,NWS STORM SURVEY REVEALED A TORNADO DAMAGED A HOME EAST OF BUTTERFIELD. MAXIMUM WINDS ESTIMATED AT 75 MPH. (SGF)
2017-03-10 00:01:00+00:00,0001,UNK,6 SW JENKINS,BARRY,MO,36.71,-93.75,EF-0 TORNADO WITH MAX ESTIMATED WINDS OF 85 MPH UPROOTED AND SNAPPED SEVERAL TREES. (SGF)
2017-03-10 00:59:00+00:00,0059,UNK,3 E BUTTERFIELD,BARRY,MO,36.75,-93.85,DAMAGE TO A HOME 3 EAST OF BUTTERFIELD. NOT CONFIRMED. NO INJURIES REPORTED. (SGF)
2017-04-05 00:56:00+00:00,0056,UNK,3 NW SELIGMAN,BARRY,MO,36.55,-93.98,A NWS STORM SURVEY FOUND THAT AN EF-1 TORNADO BRIEFLY TOUCHED DOWN ABOUT 2 MILES SOUTH OF WASHBURN IN RURAL BARRY COUNTY NEAR FARM ROAD 1055 AND FARM ROAD 2265. A CHICK (SGF)
2017-05-19 06:04:00+00:00,0604,UNK,3 SE SHELL KNOB,BARRY,MO,36.6,-93.6,EF-0 TORNADO UPROOTED NUMEROUS TREES AND DAMAGED DOCKS SOUTHEAST OF SHELL KNOB. OTHER DAMAGE OCCURRED ACROSS THE LAKE BUT COULD NOT DETERMINE SEVERITY. (SGF)
2016-03-24 04:08:00+00:00,0408,UNK,1 NNE SHELL KNOB,BARRY,MO,36.65,-93.62,NATIONAL WEATHER SERVICE GROUND SURVEY CONFIRMED A 200 YARD WIDE EF-1 TORNADO TOUCHED DOWN 1 MILE NORTH NORTH EAST OF SHELL KNOB NEAR STALLION BLUFF ROAD AND TRACKED NE (SGF)
2017-04-26 06:31:00+00:00,0631,UNK,4 ESE GOLDEN,BARRY,MO,36.5,-93.59,A NWS STORM SURVEY CONFIRMED AN EF-0 TORNADO BRIEFLY TOUCHED DOWN NEAR THE MISSOURI AND ARKANSAS BORDER NEAR ST. JOHN'S WOOD LANE IN THE AREA OF GOLDEN... MISSOURI. NUM (SGF)
2015-04-08 02:53:00+00:00,0253,UNK,5 SE AMORET,BATES,MO,38.2,-94.52,BRIEF TORNADO DESTOYED 60 FOOT MACHINE SHOP AND REMOVED SHINGLES OF HOUSE GARAGE. PRELIMINARY RATING EF0. (EAX)
2016-07-07 11:50:00+00:00,1150,UNK,2 W HALLSVILLE,BOONE,MO,39.12,-92.26,SECTION OF ROOF MISSING FROM RESIDENCE ON HIGHWAY 124 EAST (LSX)
2016-07-07 11:45:00+00:00,1145,UNK,3 E HARRISBURG,BOONE,MO,39.14,-92.4,A BRIEF AND WEAK TORNADO WAS VIDEO RECORDED EAST OF HIGHWAY NN. NO DAMAGE WAS REPORTED. INITIAL RATING WILL BE EF0. PATH LENGTH OF 0.4 MILES AND A WIDTH OF 50 YARDS BAS (LSX)
2017-07-21 22:44:00+00:00,2244,UNK,6 NE KAHOKA,CLARK,MO,40.49,-91.64,REPORT DELAYED - POSSIBLE TORNADO MOVING NORTHEAST - FUNNEL CLOUD APPEARED TO BRIEFLY TOUCH DOWN THEN LIFTED BACK INTO THE STORM (DVN)
2017-12-04 23:13:00+00:00,2313,UNK,2 SW WAYLAND,CLARK,MO,40.37,-91.61,EF-2 TORNADO TOUCHED DOWN IN AN OPEN FIELD SW OF WAYLAND... MO DAMAGING TREES AND BREAKING WINDOWS.THE TORNADO THEN MOVED ENE OVER RURAL AREAS DAMAGING TREES. AS THE TO (DVN)
2017-03-07 03:32:00+00:00,0332,UNK,BEVIER,MACON,MO,39.75,-92.56,EM RELAYED REPORT FROM COUNTY SHERIFF OF TORNADO SOUTH OF BEVIER... ALONG WITH 60+ MPH WINDS. (EAX)
2017-03-07 02:32:00+00:00,0232,UNK,BEVIER,MACON,MO,39.75,-92.56,EM RELAYED REPORT FROM COUNTY SHERIFF OF TORNADO SOUTH OF BEVIER... ALONG WITH 60+ MPH WINDS. (EAX)
2017-03-07 04:03:00+00:00,0403,UNK,1 WNW ARGYLE,OSAGE,MO,38.3,-92.04,A NWS STORM SURVEY TEAM DETERMINED AN EF-1 TORNADO BEGAN AROUND 0.75 MILES WEST NORTHWEST OF ARGYLE AND MOVED EAST NORTHEAST ACROSS SOUTHERN OSAGE COUNTY LIFTING 1 MILE (LSX)
2015-05-24 22:59:00+00:00,2259,UNK,1 WNW THEODOSIA,OZARK,MO,36.59,-92.68,A NWS STORM SURVEY TEAM FOUND THAT AN EF-1 TORNNADO TOUCHED DOWN ABOUT 1 MILE WEST OF THEODOSIA. THE TORNADO TRACKED NORTH NORTHEAST AND LIFTED ABOUT TWO AND HALF MILES (SGF)
2017-03-01 01:55:00+00:00,0155,UNK,5 WNW PERRYVILLE,PERRY,MO,37.75,-89.96,*** 1 FATAL... 12 INJ *** EF-4 TORNADO WITH A 50.4 MILE PATH THAT ENDED 1.8 MILES SW OF CHRISTOPHER... IL. PEAK WINDS WERE 180 MPH. SOME OF THE WORST DAMAGE WAS ON NORT (PAH)
2017-03-01 02:07:00+00:00,0207,UNK,1 N PERRYVILLE,PERRY,MO,37.74,-89.87,ROOF AND STRUCTURE DAMAGE REPORTED ON FAR NORTH SIDE OF COMMUNITY. SIGNIFICANT DAMAGE TO HOMES. MULTIPLE STRUCTURES DAMAGED. (PAH)
2017-03-01 02:00:00+00:00,0200,UNK,4 NE SILVER LAKE,PERRY,MO,37.72,-89.94,LARGE TORNADO VIEWED BY TRAINED SPOTTER WITHIN POWER FLASHES AND LIGHTNING. TREES DAMAGED. SEVERAL HOMES COMPLETELY DESTROYED. (PAH)
2017-03-25 23:33:00+00:00,2333,UNK,1 NW PERRY,RALLS,MO,39.44,-91.68,(LSX)
2015-07-09 01:35:00+00:00,0135,UNK,1 ESE KELSO,SCOTT,MO,37.18,-89.53,NUMEROUS TREES UPROOTED OR SNAPPED OFF. SEVERAL OUTBUILDINGS DESTROYED INCLUDING A LARGE SHED WITH THREE SIDES AND ROOF COLLAPSED. THREE CAPMER TRAILERS ROLLED ONTO THE (PAH)
2017-05-19 06:48:00+00:00,0648,UNK,1 NNW TANEYVILLE,TANEY,MO,36.76,-93.05,EF-1 TORNADO WITH WINDS OF 100 MPH OCCURRED FROM ROCKAWAY BEACH TO JUST NORTHWEST OF TANEYVILLE. NUMEROUS TREES WERE DAMAGED AND UPROOTED. (SGF)
2017-03-10 01:07:00+00:00,0107,UNK,FORSYTH,TANEY,MO,36.68,-93.12,EF0 TORNADO CAUSED DAMAGE TO A STRIP MALL ROOF AND UPROOTED TREES IN FORSYTH. ESTIMATED WINDS WERE 60-70 MPH. (SGF)
2017-03-09 23:50:00+00:00,2350,UNK,5 E REEDS SPRING,TANEY,MO,36.74,-93.3,BRIEF EF-0 TORNADO DESTROYED A WOODEN FRAMED STRUCTURE AND DAMAGED ROOFS TO 3 HOMES. . (SGF)
2017-05-19 06:30:00+00:00,0630,UNK,3 W BRANSON,TANEY,MO,36.64,-93.26,*** 1 INJ *** EF-0 TORNADO WITH WINDS UP TO 75MPH CAUSED DAMAGE TO A MOTEL. ONE PERSON SUFFERED INJURIES. (SGF)
2015-04-03 01:33:00+00:00,0133,UNK,5 WSW GOLDEN CITY,BARTON,MO,37.37,-94.18,(SGF)
2015-07-02 02:56:00+00:00,0256,UNK,3 NW WARSAW,BENTON,MO,38.27,-93.42,NWS STORM SURVEY CONCLUDED THAT A EF1 TORNADO WITH A ESTIMATED MAXIMUM WIND SPEED OF 94 MPH TOUCHED DOWN 3 MILES NW OF WARSAW. IT HAD A PATH WIDTH OF 1/4 TO 1/2 MILE WI (SGF)
2017-05-28 01:18:00+00:00,0118,UNK,6 NW POPLAR BLUFF,BUTLER,MO,36.83,-90.48,LATE REPORT...EF-0 TORNADO. PEAK WIND 85 MPH. PATH LENGTH 2.25 MILES. MAX WIDTH 85 YARDS. TORNADO BEGAN NEAR INTERSECTION OF HWY PP AND CNTY RD 429 AND END 4.25 MILES N (PAH)
2017-03-09 23:32:00+00:00,2332,UNK,9 NW POPLAR BLUFF,BUTLER,MO,36.86,-90.52,EF-1 TORNADO. PEAK WINDS ESTIMATED NEAR 105 MPH. PATH LENGTH ABOUT 6 MILES. PATH WIDTH 100 YARDS. MUCH OF PATH WAS IN REMOTE AREA OF MARK TWAIN NATIONAL FOREST. NUMEROU (PAH)
2017-03-07 04:33:00+00:00,0433,UNK,1 WSW MACKS CREEK,CAMDEN,MO,37.96,-92.99,NWS SURVEY TEAM DETERMINED THAT AN EF1 TORNADO WITH 100-110 MPH WINDS DAMAGED A MOBILE HOME... OUTBUILDINGS AND TREES FROM 1 MILE SOUTHWEST OF MACKS CREEK TO 1.5 MILES (SGF)
2017-03-07 05:33:00+00:00,0533,UNK,1 WSW MACKS CREEK,CAMDEN,MO,37.96,-92.99,NWS SURVEY TEAM DETERMINED THAT AN EF1 TORNADO WITH 100-110 MPH WINDS DAMAGED A MOBILE HOME... OUTBUILDINGS AND TREES FROM 1 MILE SOUTHWEST OF MACKS CREEK TO 1.5 MILES (SGF)
2015-12-23 15:43:00+00:00,1543,UNK,CHILTON,CARTER,MO,36.93,-90.92,EF-1 TORNADO. 95 MPH WINDS. 6 MILE TRACK FROM JUST SOUTHWEST OF CHILTON TO 5 NE OF CHILTON. 100 YARDS WIDE. OLD SCHOOL HOUSE NEARLY DESTROYED. HUNDREDS OF TREES SNAPPED (PAH)
2015-05-17 07:38:00+00:00,0738,UNK,11 NNE BUFFALO,DALLAS,MO,37.79,-93.01,A NATIONAL WEATHER SERVICE STORM SURVEY REVEALED THAT AN EF-0 TORNADO TOUCHED DOWN ON A FARM ALONG HIGHWAY 73 ROUGHLY 10.63 MILES NORTH NORTHEAST OF BUFFALO. DAMAGE TO (SGF)
2017-03-01 06:30:00+00:00,0630,UNK,3 N BUFFALO,DALLAS,MO,37.68,-93.1,A NWS STORM SURVEY INDICATED THAT A BRIEF AND WEAK EF-0 TORNADO TOUCHED DOWN JUST NORTH OF BUFFALO ALONG ROCKET ROAD. THE TORNADO STARTED JUST WEST OF HIGHWAY 65 ALONG (SGF)
2017-06-29 01:53:00+00:00,0153,UNK,2 W STANBERRY,GENTRY,MO,40.22,-94.58,TORNADO ON THE GROUND FOR A COUPLE MINUTES NEAR HWY 136 NEAR THE NODAWAY AND GENTRY COUNTY LINE. (EAX)
2016-04-27 06:49:00+00:00,0649,UNK,1 NE BATTLEFIELD,GREENE,MO,37.13,-93.36,A NATIONAL WEATHER SERVICE STORM SURVEY REVEALED THAT AN EF-0 TORNADO DAMAGED A HOME JUST OUTSIDE OF THE SOUTHWEST EDGE OF SPRINGFIELD. DAMAGE TO THE ROOF...GUTTERS...A (SGF)
2017-05-19 06:54:00+00:00,0654,UNK,1 SSW TURNERS,GREENE,MO,37.17,-93.16,EF-0 TORNADO UPROOTED NUMEROUS TREES ALONG ITS PATH. SOME TREES FELL ON HOMES. MAXIMUM WINDS WERE ESTIMATED AT 85 MPH WITH A PATH LENGTH OF 2.4 MILES. (SGF)
2016-05-27 23:14:00+00:00,2314,UNK,5 SW TRENTON,GRUNDY,MO,40.03,-93.68,FUNNEL CLOUD BRIEFLY TOUCHED DOWN. DUST VISIBLE ON GROUND. NO DAMAGE KNOWN AT THIS TIME. (EAX)
2016-05-27 23:29:00+00:00,2329,UNK,1 S BRIMSON,GRUNDY,MO,40.13,-93.74,BRIEF TORNADO...NO DAMAGE REPORTED. DUST SWIRL REPORTED ON GROUND. (EAX)
2015-04-03 05:52:00+00:00,0552,UNK,3 NNW POMONA,HOWELL,MO,36.91,-91.93,RATING: EF-2 ESTIMATED PEAK WIND: 120 MPH PATH LENGTH /STATUTE/: 7.6 MILES PATH WIDTH /MAXIMUM/: 440 YARDS FATALITIES: 0 INJURIES: 0 START DATE: APR 03 2015 START TIME: (SGF)
2015-04-03 01:20:00+00:00,0120,UNK,2 NW JASPER,JASPER,MO,37.36,-94.33,(SGF)
2015-04-03 02:10:00+00:00,0210,UNK,3 SE WEBB CITY,JASPER,MO,37.12,-94.44,AN EF-0 TORNADO WITH WINDS ESTIMATED AROUND 80 MPH CAUSED DAMAGE TO A SINGLE FAMILY HOME...ALONG WITH SEVERAL TREES AND OUTBUILDINGS ON THE PROPERTY. (SGF)
2015-07-02 03:55:00+00:00,0355,UNK,7 NE DIXON,MARIES,MO,38.06,-92.0,A NWS STORM SURVEY FOUND A BRIEF EF-0 TORNADO TOUCHED DOWN NEAR HIGHWAY E NEAR HAYDEN. THE TORNADO UPROOTED ONE TREE AND SEVERAL LARGE TREE BRANCHES WERE BLOWN DOWN ACR (SGF)
2017-06-29 00:11:00+00:00,0011,UNK,3 NNE PRINCETON,MERCER,MO,40.44,-93.57,BARN DESTROYED... POWER LINES DOWN. POSSIBLE TORNADO DAMAGE. (EAX)
2017-12-05 00:18:00+00:00,0018,UNK,3 S BRUMLEY,MILLER,MO,38.04,-92.48,A NWS SURVEY REVEALED THAT AN EF-1 TORNADO TRACKED FROM THIS LOCATION FOR 0.37 MILE PRODUCING DAMAGE TO A HOUSE... TREES AND OUTBUILDING. THE DURATION OF THE TORNADO EV (SGF)
2017-03-07 03:40:00+00:00,0340,UNK,13 SW SHELBINA,MONROE,MO,39.56,-92.21,A NWS STORM SURVEY TEAM DETERMINED A EF-1 TORNADO BEGAN AROUND 13.4 MILES SOUTHWEST OF SHELBINA AND MOVED NORTHEAST LIFTING 5.5 MILES NORTHEAST OF SHELBINA. THE PATH LE (LSX)
2017-03-07 04:37:00+00:00,0437,UNK,1 S ROCKY MOUNT,MORGAN,MO,38.25,-92.72,EF0 TORNADO PRODUCED 75-85 MPH WINDS THAT DAMAGED OUTBUILDINGS AND DOCKS. MAX WIDTH WAS 50 YARDS WIDE. (SGF)
2017-05-27 19:38:00+00:00,1938,UNK,1 N SUNRISE BEACH,MORGAN,MO,38.19,-92.78,NWS STORM SURVEY TEAM CONFIRMED AN EF-1 TORNADO THAT BRIEFLY TOUCHED DOWN APPROXIMATELY 1 MILE NORTH OF SUNRISE BEACH. THE TORNADO HAD A PATH WIDTH OF 50 YARDS. MAXIMUM (SGF)
2017-05-11 05:35:00+00:00,0535,UNK,4 NW NEOSHO,NEWTON,MO,36.91,-94.41,A NWS STORM SURVEY FOUND THAT A BRIEF EF-0 TORNADO TOUCHED DOWN NEAR THE INTERSECTION OF GATEWAY DRIVE AND JUTE ROAD NORTH OF NEOSHO. SEVERAL TREES WERE UPROOTED. SEVER (SGF)
2016-04-27 05:21:00+00:00,0521,UNK,2 N SENECA,NEWTON,MO,36.86,-94.61,NWS STORM SURVEY TEAM CONFIRMED AN EF1 TORNADO APPROXIMATELY TWO MILES NORTH OF SENECA MISSOURI. THE PATH WAS APPROXIMATELY ONE MILE WITH A WIDTH OF 150 YARDS. MAXIMUM (SGF)
2017-05-19 20:10:00+00:00,2010,UNK,NEOSHO,NEWTON,MO,36.87,-94.37,AN EF-1 TORNADO TOUCHED DOWN ALONG US HIGHWAY 60 ON THE NORTHEAST SIDE OF NEOSHO. THE DAMAGE PATH WAS ABOUT 4 MILES LONG AND 300 YARDS WIDE WITH ESTIMATED WINDS OF 95 M (SGF)
2015-05-17 05:56:00+00:00,0556,UNK,4 S SENECA,NEWTON,MO,36.78,-94.61,A NWS STORM SURVEY FOUND AN EF-1 TORNADO TOUCHED NEAR THE MISSOURI AND OKLAHOMA BORDER ALONG HIGHWAY 43 ABOUT 4 MILES SOUTH OF SENECA AND TRACKED NORTHEAST. THE TORNADO (SGF)
2017-05-19 08:12:00+00:00,0812,UNK,1 NNW THAYER,OREGON,MO,36.53,-91.54,EF-0 TORNADO WITH WINDS OF 85 MPH TOUCHED DOWN ON THE NORTHEAST SIDE OF THAYER. THE TORNADO WAS ABOUT 300 YARDS WIDE AND THREE-QUARTERS OF A MILE LONG. NUMEROUS TREES W (SGF)
2017-05-20 08:12:00+00:00,0812,UNK,THAYER,OREGON,MO,36.53,-91.54,***CORRECTION FOR DATE AND TIME*** EF-0 TORNADO WITH WINDS OF 85 MPH TOUCHED DOWN ON THE NORTHEAST SIDE OF THAYER. THE TORNADO WAS ABOUT 300 YARDS WIDE AND THREE-QUARTE (SGF)
2017-03-07 00:22:00+00:00,0022,UNK,3 N KANSAS CITY INTL AR,PLATTE,MO,39.33,-94.72,SPOTTER REPORTS A TORNADO . (EAX)
2017-03-07 01:22:00+00:00,0122,UNK,3 N KANSAS CITY INTL AR,PLATTE,MO,39.33,-94.72,SPOTTER REPORTS A TORNADO . (EAX)
2016-06-01 00:03:00+00:00,0003,UNK,UNIONVILLE,PUTNAM,MO,40.48,-93.0,TORNADO OCCURRED IN AN OPEN FIELD. NO DAMAGE REPORTED. (EAX)
2017-03-09 23:45:00+00:00,2345,UNK,6 N DONIPHAN,RIPLEY,MO,36.71,-90.82,EF-2 TORNADO TRAVELLED FROM APPROXIMATELY 6 MILES NORTH OF DONIPHAN MO TO 12 MILES NORTHEAST OF DONIPHAN MO. WINDS ESTIMATED NEAR 120 MPH. HUNDREDS TO THOUSANDS OF LARG (PAH)
2017-03-07 03:49:00+00:00,0349,UNK,4 WNW SHELBINA,SHELBY,MO,39.71,-92.1,*** 1 INJ *** EF-1 TORNADO WAS SURVEYED WITH MAXIMUM WINDS OF 100 MPH. THE TORNADO WAS 16 MILES LONG AND 150 YARDS WIDE. THE BULK OF THE DAMAGE WAS EF-0...PRIMARILY TO (LSX)
2016-04-28 01:25:00+00:00,0125,UNK,2 N EMDEN,SHELBY,MO,39.83,-91.86,RELAYED BY 911. (LSX)
2017-03-07 04:03:00+00:00,0403,UNK,2 W SHELBINA,SHELBY,MO,39.69,-92.08,EXTENSIVE DAMAGE TO SOUTH COUNTY HIGH SCHOOL (LSX)
2017-03-07 05:27:00+00:00,0527,UNK,5 N BERGER,WARREN,MO,38.75,-91.33,EF1 TORNADO SURVEYED WITH MAXIMUM WINDS OF 100 MPH. THE TORNADO WAS 21 MILES LONG AND 150 YARDS WIDE. THE TORNADO DID MOSTLY TREE DAMAGE....BUT DID ALSO DO SOME STRUCTU (LSX)
2015-04-09 22:54:00+00:00,2254,UNK,WRIGHT CITY,WARREN,MO,38.83,-91.02,BRIEF TOUCHDOWN OF A FEW SECONDS. FUNNEL CLOUD STILL VISIBLE TO THE E OR NE. (LSX)
2017-05-19 08:00:00+00:00,0800,UNK,1 N DAWSON,WRIGHT,MO,37.27,-92.31,AN EF-0 TORNADO WITH ESTIMATED 85 MPH WINDS BRIEFLY TOUCHED DOWN ABOUT ONE MILE NORTH OF DAWSON OR 10 MILES NORTH OF MOUNTAIN GROVE. THE TORNADO WAS ABOUT 40 YDS WIDE A (SGF)
2016-04-19 23:20:00+00:00,2320,UNK,2 N LADDONIA,AUDRAIN,MO,39.27,-91.64,ROOM DAMAGE TO A MACHINE SHED. TIME ESTIMATED FROM RADAR. (LSX)
2017-03-07 01:40:00+00:00,0140,UNK,CARROLLTON,CARROLL,MO,39.37,-93.5,MAJOR DAMAGE. 1 POWER POLE FELL ON A VEHICLE WITH PEOPLE IN IT. THEY WERE RESCUED AND UNHARMED. THERE ARE ALSO POWER LINES OVER THE RAILROAD. (EAX)
2017-03-07 02:40:00+00:00,0240,UNK,CARROLLTON,CARROLL,MO,39.36,-93.5,POSSIBLE TORNADO IN CARROLLTON. (EAX)
2017-03-07 00:27:00+00:00,0027,UNK,4 WSW LATHROP,CLINTON,MO,39.53,-94.4,POSSIBLE TORNADO DAMAGE FROM JUST SOUTH OF TRIMBLE TO JUST EAST OF LATHROP. WIDESPREAD STRUCTURAL... UTILITY... AND VEGETATION DAMAGE RANGING FROM MINOR TO MAJOR. POWER (EAX)
2017-03-07 01:27:00+00:00,0127,UNK,4 WSW LATHROP,CLINTON,MO,39.53,-94.4,POSSIBLE TORNADO DAMAGE FROM JUST SOUTH OF TRIMBLE TO JUST EAST OF LATHROP. WIDESPREAD STRUCTURAL... UTILITY... AND VEGETATION DAMAGE RANGING FROM MINOR TO MAJOR. POWER (EAX)
2016-08-27 00:40:00+00:00,0040,UNK,1 N LATHROP,CLINTON,MO,39.56,-94.33,MULTIPLE REPORTS IN THE SAME AREA. (EAX)
2017-03-07 00:43:00+00:00,0043,UNK,LATHROP,CLINTON,MO,39.55,-94.33,PHOTO OF BOARD DRIVEN THROUGH STONE FACADE ON HOME...REPORT VIA SOCIAL MEDIA. (EAX)
2016-08-27 00:35:00+00:00,0035,UNK,4 S TURNEY,CLINTON,MO,39.58,-94.32,(EAX)
2016-08-27 00:25:00+00:00,0025,UNK,3 W LATHROP,CLINTON,MO,39.55,-94.39,DUST CLOUD AND POWER FLASHES BELOW FUNNEL. (EAX)
2017-03-07 01:43:00+00:00,0143,UNK,LATHROP,CLINTON,MO,39.55,-94.33,PHOTO OF BOARD DRIVEN THROUGH STONE FACADE ON HOME...REPORT VIA SOCIAL MEDIA. (EAX)
